{
  "$schema": "https://json-schema.org/draft/2020-12/schema",
  "$id": "https://trustweave.dev/schemas/finding/v1alpha1",
  "title": "TrustWeave Embedded Canonical Local Finding v1alpha1",
  "$comment": "Embedded findings inherit their schema version from the containing versioned artifact; they do not repeat schema_version.",
  "type": "object",
  "required": ["id", "severity", "message", "evidence_kind"],
  "properties": {
    "id": {"type": "string", "pattern": "^TW-[A-Z0-9-]{1,120}$"},
    "title": {"type": "string", "minLength": 1, "maxLength": 256},
    "severity": {"enum": ["critical", "high", "medium", "low", "info", "review"]},
    "message": {"type": "string", "minLength": 1, "maxLength": 4096},
    "rationale": {"type": "string", "minLength": 1, "maxLength": 4096},
    "remediation": {"type": "string", "minLength": 1, "maxLength": 4096},
    "evidence_kind": {"type": "string", "pattern": "^[a-z][a-z0-9_]{0,127}$"},
    "subject": {"$ref": "#/$defs/string_map"},
    "location": {"$ref": "#/$defs/string_map"},
    "references": {
      "type": "array",
      "maxItems": 64,
      "items": {"$ref": "#/$defs/string_map"}
    },
    "properties": {"$ref": "#/$defs/safe_property_map"}
  },
  "$defs": {
    "string_map": {
      "type": "object",
      "maxProperties": 32,
      "propertyNames": {"pattern": "^[a-z][a-z0-9_]{0,63}$"},
      "additionalProperties": {"type": "string", "minLength": 1, "maxLength": 1024}
    },
    "safe_property_map": {
      "type": "object",
      "maxProperties": 64,
      "propertyNames": {"pattern": "^[a-z][a-z0-9_]{0,63}$"},
      "additionalProperties": {
        "oneOf": [
          {"type": "string", "minLength": 1, "maxLength": 1024},
          {"type": "boolean"},
          {
            "type": "array",
            "maxItems": 128,
            "items": {"type": "string", "minLength": 1, "maxLength": 1024}
          }
        ]
      }
    }
  },
  "additionalProperties": false
}
